### ISSUE TITLE
Bug: Cilium with eBPF is not working as intended

### ISSUE THREAD

**Issue by Despire** [berops/claudie#1036]
### Current Behaviour
When opting out of using kube-proxy with cilium network packets send from the LoadBalancers can't reach the desired service unless it is sending the traffic to the node on which the service is running. This happens only when using private IPs from the Loadbalancers, when using public IPs or even cummunicating from nodes that are part of the cluster everything works

### Expected Behaviour

The above describe issue should work for nodes that are part of the cluster (worker, control) and also LoadBalancers attached to the cluster

### Steps To Reproduce
1. setup cluster in eBPF mode cilium
2. try to ssh into any Loadbalancer attached to the cluster and curl a service exported with service type `NodePort`
3. You should be able to verify that the service is only reachable on the node on which it is running, other fail

**Comment by bernardhalas** [comment]
This is linked to #598 .

**Comment by JKBGIT1** [comment]
I am currently out of ideas on what else to try to solve this issue.

I set up the k8s cluster just the way it is on the picture at the end of this comment. The red arrow lines from one node to another means that a node returns connection timeout. On the other hand, the green ones stand for valid responses. 

To install the Cilium I have used the [Cilium helm chart](https://artifacthub.io/packages/helm/cilium/cilium). In addition, I have tried all the installation parameters of this helm chart that are somehow connected with NodePort (this is how we expose the backend service to the Internet...) or load balancing in the cluster, unfortunately without any success.

I have used `tcpdump`, `hubble` and `cilium monitor` to find out, where the network packet gets lost, but I wasn't able to track it. A spark of small hope appeared when I found out that Cilium supports monitoring only for the dropped packets with `cilium monitor –type drop`, but the lost packet did not appear in the output of this cmd.

IMO the weirdest thing is that running `curl 192.168.0.2:30080` from the master node returns a valid response (see the img), but it isn't going through the `wg0` interface, even though I used the WG IP. It is going only through `cilium_host`, `cilium_net` and `cilium_vxlan` interfaces. 

One more important thing. Running `curl 192.168.0.3:30080` from `master node` or `Just a VM in Wireguard network` (see img) to access the backend on the `worker node` returns a valid response that goes through the interfaces `wg0`, `ens4` and `lxc8cbd0f4bc5bb@if18` (see the network interfaces below). In the case of the `master node` interface `lxc8cbd0f4bc5bb@if18` doesn't exist and I am wondering, whether this might be the reason why the request fails.

```
#####################
#### K8s worker #####
#####################
1: lo: <LOOPBACK,UP,LOWER_UP> mtu 65536 qdisc noqueue state UNKNOWN group default qlen 1000
    link/loopback 00:00:00:00:00:00 brd 00:00:00:00:00:00
    inet 127.0.0.1/8 scope host lo
       valid_lft forever preferred_lft forever
    inet6 ::1/128 scope host 
       valid_lft forever preferred_lft forever
2: ens4: <BROADCAST,MULTICAST,UP,LOWER_UP> mtu 1460 qdisc mq state UP group default qlen 1000
    link/ether 42:01:0a:9c:00:0d brd ff:ff:ff:ff:ff:ff
    altname enp0s4
    inet 10.156.0.13/32 scope global dynamic ens4
       valid_lft 83112sec preferred_lft 83112sec
    inet6 fe80::4001:aff:fe9c:d/64 scope link 
       valid_lft forever preferred_lft forever
3: wg0: <POINTOPOINT,NOARP,UP,LOWER_UP> mtu 1380 qdisc noqueue state UNKNOWN group default qlen 1000
    link/none 
    inet 192.168.0.3/16 scope global wg0
       valid_lft forever preferred_lft forever
4: docker0: <NO-CARRIER,BROADCAST,MULTICAST,UP> mtu 1500 qdisc noqueue state DOWN group default 
    link/ether 02:42:c0:99:69:14 brd ff:ff:ff:ff:ff:ff
    inet 172.17.0.1/16 brd 172.17.255.255 scope global docker0
       valid_lft forever preferred_lft forever
5: cilium_net@cilium_host: <BROADCAST,MULTICAST,NOARP,UP,LOWER_UP> mtu 1460 qdisc noqueue state UP group default qlen 1000
    link/ether 5e:f6:84:81:c5:ad brd ff:ff:ff:ff:ff:ff
    inet6 fe80::5cf6:84ff:fe81:c5ad/64 scope link 
       valid_lft forever preferred_lft forever
6: cilium_host@cilium_net: <BROADCAST,MULTICAST,NOARP,UP,LOWER_UP> mtu 1460 qdisc noqueue state UP group default qlen 1000
    link/ether 9a:87:12:1a:eb:74 brd ff:ff:ff:ff:ff:ff
    inet 10.0.0.120/32 scope global cilium_host
       valid_lft forever preferred_lft forever
    inet6 fe80::9887:12ff:fe1a:eb74/64 scope link 
       valid_lft forever preferred_lft forever
7: cilium_vxlan: <BROADCAST,MULTICAST,UP,LOWER_UP> mtu 1460 qdisc noqueue state UNKNOWN group default qlen 1000
    link/ether 92:d1:3f:77:e3:cf brd ff:ff:ff:ff:ff:ff
    inet6 fe80::90d1:3fff:fe77:e3cf/64 scope link 
       valid_lft forever preferred_lft forever
9: lxc_health@if8: <BROADCAST,MULTICAST,UP,LOWER_UP> mtu 1460 qdisc noqueue state UP group default qlen 1000
    link/ether b6:10:1d:1b:c3:0e brd ff:ff:ff:ff:ff:ff link-netnsid 0
    inet6 fe80::b410:1dff:fe1b:c30e/64 scope link 
       valid_lft forever preferred_lft forever
11: lxc91ff2727a170@if10: <BROADCAST,MULTICAST,UP,LOWER_UP> mtu 1460 qdisc noqueue state UP group default qlen 1000
    link/ether a6:e0:51:4e:7f:5a brd ff:ff:ff:ff:ff:ff link-netns cni-b5a61ff4-66f0-ac46-79da-eecdf7801765
    inet6 fe80::a4e0:51ff:fe4e:7f5a/64 scope link 
       valid_lft forever preferred_lft forever
13: lxc95fbf4cc2211@if12: <BROADCAST,MULTICAST,UP,LOWER_UP> mtu 1460 qdisc noqueue state UP group default qlen 1000
    link/ether 92:77:8b:47:99:52 brd ff:ff:ff:ff:ff:ff link-netns cni-59fb81cb-96ba-dbe5-a2d2-d8e86dd096e7
    inet6 fe80::9077:8bff:fe47:9952/64 scope link 
       valid_lft forever preferred_lft forever
15: lxc46ed20d78e0c@if14: <BROADCAST,MULTICAST,UP,LOWER_UP> mtu 1460 qdisc noqueue state UP group default qlen 1000
    link/ether fa:42:31:63:1c:bd brd ff:ff:ff:ff:ff:ff link-netns cni-38613cfd-f159-6dc3-936e-037ca3737e33
    inet6 fe80::f842:31ff:fe63:1cbd/64 scope link 
       valid_lft forever preferred_lft forever
17: lxca992218b839c@if16: <BROADCAST,MULTICAST,UP,LOWER_UP> mtu 1460 qdisc noqueue state UP group default qlen 1000
    link/ether 66:5b:53:4b:ed:dd brd ff:ff:ff:ff:ff:ff link-netns cni-f0887e50-9818-9f58-1ba6-46fa433e9ebc
    inet6 fe80::645b:53ff:fe4b:eddd/64 scope link 
       valid_lft forever preferred_lft forever
19: lxc8cbd0f4bc5bb@if18: <BROADCAST,MULTICAST,UP,LOWER_UP> mtu 1460 qdisc noqueue state UP group default qlen 1000
    link/ether 22:94:c2:e7:50:f5 brd ff:ff:ff:ff:ff:ff link-netns cni-3fc7ceda-c9df-aff1-1f15-ce6070360ed3
    inet6 fe80::2094:c2ff:fee7:50f5/64 scope link 
       valid_lft forever preferred_lft forever

#####################
#### K8s master #####
#####################
1: lo: <LOOPBACK,UP,LOWER_UP> mtu 65536 qdisc noqueue state UNKNOWN group default qlen 1000
    link/loopback 00:00:00:00:00:00 brd 00:00:00:00:00:00
    inet 127.0.0.1/8 scope host lo
       valid_lft forever preferred_lft forever
    inet6 ::1/128 scope host 
       valid_lft forever preferred_lft forever
2: ens4: <BROADCAST,MULTICAST,UP,LOWER_UP> mtu 1460 qdisc mq state UP group default qlen 1000
    link/ether 42:01:0a:9c:00:0a brd ff:ff:ff:ff:ff:ff
    altname enp0s4
    inet 10.156.0.10/32 scope global dynamic ens4
       valid_lft 80716sec preferred_lft 80716sec
    inet6 fe80::4001:aff:fe9c:a/64 scope link 
       valid_lft forever preferred_lft forever
3: wg0: <POINTOPOINT,NOARP,UP,LOWER_UP> mtu 1380 qdisc noqueue state UNKNOWN group default qlen 1000
    link/none 
    inet 192.168.0.2/16 scope global wg0
       valid_lft forever preferred_lft forever
4: docker0: <NO-CARRIER,BROADCAST,MULTICAST,UP> mtu 1500 qdisc noqueue state DOWN group default 
    link/ether 02:42:c2:42:8c:39 brd ff:ff:ff:ff:ff:ff
    inet 172.17.0.1/16 brd 172.17.255.255 scope global docker0
       valid_lft forever preferred_lft forever
5: cilium_net@cilium_host: <BROADCAST,MULTICAST,NOARP,UP,LOWER_UP> mtu 1460 qdisc noqueue state UP group default qlen 1000
    link/ether fe:c3:14:ec:d3:78 brd ff:ff:ff:ff:ff:ff
    inet6 fe80::fcc3:14ff:feec:d378/64 scope link 
       valid_lft forever preferred_lft forever
6: cilium_host@cilium_net: <BROADCAST,MULTICAST,NOARP,UP,LOWER_UP> mtu 1460 qdisc noqueue state UP group default qlen 1000
    link/ether 22:17:67:62:29:bb brd ff:ff:ff:ff:ff:ff
    inet 10.0.1.124/32 scope global cilium_host
       valid_lft forever preferred_lft forever
    inet6 fe80::2017:67ff:fe62:29bb/64 scope link 
       valid_lft forever preferred_lft forever
7: cilium_vxlan: <BROADCAST,MULTICAST,UP,LOWER_UP> mtu 1460 qdisc noqueue state UNKNOWN group default qlen 1000
    link/ether 6e:9f:22:33:85:ff brd ff:ff:ff:ff:ff:ff
    inet6 fe80::6c9f:22ff:fe33:85ff/64 scope link 
       valid_lft forever preferred_lft forever
9: lxc_health@if8: <BROADCAST,MULTICAST,UP,LOWER_UP> mtu 1460 qdisc noqueue state UP group default qlen 1000
    link/ether f2:0a:42:0c:d4:67 brd ff:ff:ff:ff:ff:ff link-netnsid 0
    inet6 fe80::f00a:42ff:fe0c:d467/64 scope link 
       valid_lft forever preferred_lft forever
```

Full helm cmd that I used to install Cilium that created previous interfaces and the settings in the Cilium config down below.
``` bash
helm install cilium cilium/cilium --version 1.14.4 --namespace kube-system --set kubeProxyReplacement=true --set k8sServiceHost=${API_SERVER_IP} --set k8sServicePort=6443 \
    --set hubble.relay.enabled=true \
    --set hubble.ui.enabled=true \
    --set devices=wg0 \
    --set nodePort.directRoutingDevice=wg0 \
    --set bpf.lbExternalClusterIP=true \
    --set externalIPs.enabled=true
```

Cilium config:
``` bash
  agent-not-ready-taint-key: node.cilium.io/agent-not-ready
  arping-refresh-period: 30s
  auto-direct-node-routes: "false"
  bpf-lb-external-clusterip: "true"
  bpf-lb-map-max: "65536"
  bpf-lb-sock: "false"
  bpf-map-dynamic-size-ratio: "0.0025"
  bpf-policy-map-max: "16384"
  bpf-root: /sys/fs/bpf
  cgroup-root: /run/cilium/cgroupv2
  cilium-endpoint-gc-interval: 5m0s
  cluster-id: "0"
  cluster-name: default
  cluster-pool-ipv4-cidr: 10.0.0.0/8
  cluster-pool-ipv4-mask-size: "24"
  cni-exclusive: "true"
  cni-log-file: /var/run/cilium/cilium-cni.log
  cnp-node-status-gc-interval: 0s
  custom-cni-conf: "false"
  debug: "false"
  debug-verbose: ""
  devices: wg0
  direct-routing-device: wg0
  disable-cnp-status-updates: "true"
  egress-gateway-reconciliation-trigger-interval: 1s
  enable-auto-protect-node-port-range: "true"
  enable-bgp-control-plane: "false"
  enable-bpf-clock-probe: "false"
  enable-endpoint-health-checking: "true"
  enable-health-check-nodeport: "true"
  enable-health-checking: "true"
  enable-hubble: "true"
  enable-ipv4: "true"
  enable-ipv4-big-tcp: "false"
  enable-ipv4-masquerade: "true"
  enable-ipv6: "false"
  enable-ipv6-big-tcp: "false"
  enable-ipv6-masquerade: "true"
  enable-k8s-networkpolicy: "true"
  enable-k8s-terminating-endpoint: "true"
  enable-l2-neigh-discovery: "true"
  enable-l7-proxy: "true"
  enable-local-redirect-policy: "false"
  enable-policy: default
  enable-remote-node-identity: "true"
  enable-sctp: "false"
  enable-svc-source-range-check: "true"
  enable-vtep: "false"
  enable-well-known-identities: "false"
  enable-xt-socket-fallback: "true"
  external-envoy-proxy: "false"
  hubble-disable-tls: "false"
  hubble-listen-address: :4244
  hubble-socket-path: /var/run/cilium/hubble.sock
  hubble-tls-cert-file: /var/lib/cilium/tls/hubble/server.crt
  hubble-tls-client-ca-files: /var/lib/cilium/tls/hubble/client-ca.crt
  hubble-tls-key-file: /var/lib/cilium/tls/hubble/server.key
  identity-allocation-mode: crd
  identity-gc-interval: 15m0s
  identity-heartbeat-timeout: 30m0s
  install-no-conntrack-iptables-rules: "false"
  ipam: cluster-pool
  ipam-cilium-node-update-rate: 15s
  k8s-client-burst: "10"
  k8s-client-qps: "5"
  kube-proxy-replacement: "true"
  kube-proxy-replacement-healthz-bind-address: ""
  mesh-auth-enabled: "true"
  mesh-auth-gc-interval: 5m0s
  mesh-auth-queue-size: "1024"
  mesh-auth-rotated-identities-queue-size: "1024"
  monitor-aggregation: medium
  monitor-aggregation-flags: all
  monitor-aggregation-interval: 5s
  node-port-bind-protection: "true"
  nodes-gc-interval: 5m0s
  operator-api-serve-addr: 127.0.0.1:9234
  preallocate-bpf-maps: "false"
  procfs: /host/proc
  proxy-connect-timeout: "2"
  proxy-max-connection-duration-seconds: "0"
  proxy-max-requests-per-connection: "0"
  proxy-prometheus-port: "9964"
  remove-cilium-node-taints: "true"
  routing-mode: tunnel
  set-cilium-is-up-condition: "true"
  set-cilium-node-taints: "true"
  sidecar-istio-proxy-image: cilium/istio_proxy
  skip-cnp-status-startup-clean: "false"
  synchronize-k8s-nodes: "true"
  tofqdns-dns-reject-response-code: refused
  tofqdns-enable-dns-compression: "true"
  tofqdns-endpoint-max-ip-per-hostname: "50"
  tofqdns-idle-connection-grace-period: 0s
  tofqdns-max-deferred-connection-deletes: "10000"
  tofqdns-proxy-response-max-delay: 100ms
  tunnel-protocol: vxlan
  unmanaged-pod-watcher-interval: "15"
  vtep-cidr: ""
  vtep-endpoint: ""
  vtep-mac: ""
  vtep-mask: ""
  write-cni-conf-when-ready: /host/etc/cni/net.d/05-cilium.conflist
```

The k8s cluster was build with `kubeadm v1.28.4`, I used `helm 1.14.4`, Cilium `1.14.4`, but also tried the `1.15.0-rc.0`, which was latest by that time. All the nodes were GCE VMs.

I have also asked for help on Cilium Slack twice, but got a response only once, and a guy told me that they have a [similar issue](https://cilium.slack.com/archives/C53TG4J4R/p1694610254256729). In their case allowing asymmetric routing helped. However, in our case, it didn't.
https://cilium.slack.com/archives/C53TG4J4R/p1694610254256729
https://cilium.slack.com/archives/C53TG4J4R/p1703007632944949

![Image](https://github.com/berops/claudie/assets/43497822/223c2e51-d299-4850-8ed9-2f70c8140502)

**Comment by rastislavs** [comment]
:wave:  From brief looking at the issue, I would have the following comments / suggestions:
- it seems that you are using the `ens4` interface to connect the nodes to the k8s control plane and `wg0` interface to create your custom wireguard VPN,
- in this case you should pass both interfaces to `devices` config, otherwise the traffic coming via `ens4` may not be processed correctly,
- as you are using VXLAN overlay (`routing-mode: tunnel`, `tunnel-protocol: vxlan`), the `direct-routing-device` config probably has no effect,
- it would be worth figuring out what exactly is the datapath of non-working curl and where exactly the packet is lost - and whether the syn packet (request) or sync-ack (reply) packet is actually lost. If the packet cannot be seen in tcpdump / hubble, another tool that I would suggest is https://github.com/cilium/pwru

> IMO the weirdest thing is that running curl 192.168.0.2:30080 from the master node returns a valid response (see the img), but it isn't going through the wg0 interface, even though I used the WG IP. It is going only through cilium_host, cilium_net and cilium_vxlan interfaces.

This is expected. Cilium on the master node load-balances to a backed pod IP, and all cross-node traffic to pods in your deployment scenario goes via VXLAN (and VXLAN packets via ens4).

> In the case of the master node interface lxc8cbd0f4bc5bb@if18 doesn't exist and I am wondering, whether this might be the reason why the request fails.

Nope, this is the interface which connects the host network namespace with the pod, so you can find it only on the node where the pod runs.

**Comment by JKBGIT1** [comment]
Hi @rastislavs thanks for helping out 🙏  
I have applied all your suggestions for Cilium installation and used the `pwru` tool to track the dropped packet. Thanks to the `pwru` I found out that Wireguard on the master node is responsible for dropping the packet, but the packet is dropped without any reason (see the following outputs of `pwru` tool).

The output of `pwru 'dst host 192.168.0.2' --output-meta --filter-track-skb` after running `curl 192.168.0.2:30080` from VM with Wireguard IP 192.168.0.1.

192.168.0.2 - WG IP of the master node on the `wg0` interface
192.168.0.1 - WG IP of a VM that isn't part of the k8s cluster, but is connected to the nodes from the k8s cluster via Wireguard.

```
2024/01/29 10:42:47 Attaching kprobes (via kprobe)...
1579 / 1576 [--------------------------------------------------------------------------------------------------------------------------------------------------------------------------------------] 100.19% 45 p/s
2024/01/29 10:43:23 Attached (ignored 0)
2024/01/29 10:43:23 Listening for events..
               SKB    CPU          PROCESS                     FUNC
0xffff89762b619100      1 [kworker/1:13-wg-crypt-wg0(8846)]         napi_gro_receive netns=4026531840 mark=0x0 iface=4(wg0) proto=0x0800 mtu=1380 len=60
0xffff89762b619100      1 [kworker/1:13-wg-crypt-wg0(8846)]          dev_gro_receive netns=4026531840 mark=0x0 iface=4(wg0) proto=0x0800 mtu=1380 len=60
0xffff89762b619100      1 [kworker/1:13-wg-crypt-wg0(8846)]         inet_gro_receive netns=4026531840 mark=0x0 iface=4(wg0) proto=0x0800 mtu=1380 len=60
0xffff89762b619100      1 [kworker/1:13-wg-crypt-wg0(8846)]         tcp4_gro_receive netns=4026531840 mark=0x0 iface=4(wg0) proto=0x0800 mtu=1380 len=60
0xffff89762b619100      1 [kworker/1:13-wg-crypt-wg0(8846)]          tcp_gro_receive netns=4026531840 mark=0x0 iface=4(wg0) proto=0x0800 mtu=1380 len=60
0xffff89762b619100      1 [kworker/1:13-wg-crypt-wg0(8846)]   skb_defer_rx_timestamp netns=4026531840 mark=0x0 iface=4(wg0) proto=0x0800 mtu=1380 len=60
0xffff89762b619100      1 [kworker/1:13-wg-crypt-wg0(8846)]             tcf_classify netns=4026531840 mark=0x0 iface=4(wg0) proto=0x0800 mtu=1380 len=60
0xffff89762b619100      1 [kworker/1:13-wg-crypt-wg0(8846)]      skb_ensure_writable netns=4026531840 mark=0x0 iface=4(wg0) proto=0x0800 mtu=1380 len=60
0xffff89762b619100      1 [kworker/1:13-wg-crypt-wg0(8846)]      skb_ensure_writable netns=4026531840 mark=0x0 iface=4(wg0) proto=0x0800 mtu=1380 len=60
0xffff89762b619100      1 [kworker/1:13-wg-crypt-wg0(8846)]      skb_ensure_writable netns=4026531840 mark=0x0 iface=4(wg0) proto=0x0800 mtu=1380 len=60
0xffff89762b619100      1 [kworker/1:13-wg-crypt-wg0(8846)]      skb_ensure_writable netns=4026531840 mark=0x0 iface=4(wg0) proto=0x0800 mtu=1380 len=60
0xffff89762b619100      1 [kworker/1:13-wg-crypt-wg0(8846)] inet_proto_csum_replace_by_diff netns=4026531840 mark=0x0 iface=4(wg0) proto=0x0800 mtu=1380 len=60
0xffff89762b619100      1 [kworker/1:13-wg-crypt-wg0(8846)]      skb_ensure_writable netns=4026531840 mark=0x0 iface=4(wg0) proto=0x0800 mtu=1380 len=60
0xffff89762b619100      1 [kworker/1:13-wg-crypt-wg0(8846)] inet_proto_csum_replace4 netns=4026531840 mark=0x0 iface=4(wg0) proto=0x0800 mtu=1380 len=60
0xffff89762b619100      1 [kworker/1:13-wg-crypt-wg0(8846)]      skb_ensure_writable netns=4026531840 mark=0x0 iface=4(wg0) proto=0x0800 mtu=1380 len=60
0xffff89762b619100      1 [kworker/1:13-wg-crypt-wg0(8846)]      skb_ensure_writable netns=4026531840 mark=0x0 iface=4(wg0) proto=0x0800 mtu=1380 len=60
0xffff89762b619100      1 [kworker/1:13-wg-crypt-wg0(8846)]      skb_ensure_writable netns=4026531840 mark=0x0 iface=4(wg0) proto=0x0800 mtu=1380 len=60
0xffff89762b619100      1 [kworker/1:13-wg-crypt-wg0(8846)]      skb_ensure_writable netns=4026531840 mark=0x0 iface=4(wg0) proto=0x0800 mtu=1380 len=60
0xffff89762b619100      1 [kworker/1:13-wg-crypt-wg0(8846)]      skb_ensure_writable netns=4026531840 mark=0x0 iface=4(wg0) proto=0x0800 mtu=1380 len=60
0xffff89762b619100      1 [kworker/1:13-wg-crypt-wg0(8846)]      skb_ensure_writable netns=4026531840 mark=0x0 iface=4(wg0) proto=0x0800 mtu=1380 len=60
0xffff89762b619100      1 [kworker/1:13-wg-crypt-wg0(8846)] inet_proto_csum_replace_by_diff netns=4026531840 mark=0x0 iface=4(wg0) proto=0x0800 mtu=1380 len=60
0xffff89762b619100      1 [kworker/1:13-wg-crypt-wg0(8846)]          skb_do_redirect netns=4026531840 mark=0x300 iface=4(wg0) proto=0x0800 mtu=1380 len=60
0xffff89762b619100      1 [kworker/1:13-wg-crypt-wg0(8846)]           __bpf_redirect netns=4026531840 mark=0x300 iface=4(wg0) proto=0x0800 mtu=1380 len=60
0xffff89762b619100      1 [kworker/1:13-wg-crypt-wg0(8846)] kfree_skb_reason(SKB_DROP_REASON_NOT_SPECIFIED) netns=4026531840 mark=0x300 iface=4(wg0) proto=0x0800 mtu=1380 len=60
0xffff89762b619100      1 [kworker/1:13-wg-crypt-wg0(8846)]   skb_release_head_state netns=4026531840 mark=0x300 iface=4(wg0) proto=0x0800 mtu=1380 len=60
0xffff89762b619100      1 [kworker/1:13-wg-crypt-wg0(8846)]         skb_release_data netns=4026531840 mark=0x300 iface=4(wg0) proto=0x0800 mtu=1380 len=60
0xffff89762b619100      1 [kworker/1:13-wg-crypt-wg0(8846)]            skb_free_head netns=4026531840 mark=0x300 iface=4(wg0) proto=0x0800 mtu=1380 len=60
0xffff89762b619100      1 [kworker/1:13-wg-crypt-wg0(8846)]             kfree_skbmem netns=4026531840 mark=0x300 iface=4(wg0) proto=0x0800 mtu=1380 len=60
```

The output of `pwru 'dst host 10.156.0.63 and port 51820' --output-meta --filter-track-skb` on the master node, after running `curl 192.168.0.2:30080` from VM with the Wireguard IP 192.168.0.1.

10.156.0.63 - private IP of the master node on the `ens4` interface
192.168.0.2 - WG IP of the master node on the `wg0` interface
192.168.0.1 - WG IP of a VM that isn't part of the k8s cluster, but is connected to the nodes in the k8s cluster via Wireguard.

```
2024/01/29 10:34:46 Attached (ignored 0)
2024/01/29 10:34:46 Listening for events..
               SKB    CPU          PROCESS                     FUNC
0xffff8976c4b73a00      0     [<empty>(0)]         inet_gro_receive netns=4026531840 mark=0x0 iface=2(ens4) proto=0x0800 mtu=1460 len=176
0xffff8976c4b73a00      0     [<empty>(0)]         udp4_gro_receive netns=4026531840 mark=0x0 iface=2(ens4) proto=0x0800 mtu=1460 len=176
0xffff8976c4b73a00      0     [<empty>(0)]          udp_gro_receive netns=4026531840 mark=0x0 iface=2(ens4) proto=0x0800 mtu=1460 len=176
0xffff8976c4b73a00      0     [<empty>(0)]   skb_defer_rx_timestamp netns=4026531840 mark=0x0 iface=2(ens4) proto=0x0800 mtu=1460 len=176
0xffff8976c4b73a00      0     [<empty>(0)]             tcf_classify netns=4026531840 mark=0x0 iface=2(ens4) proto=0x0800 mtu=1460 len=176
0xffff8976c4b73a00      0     [<empty>(0)]      skb_ensure_writable netns=4026531840 mark=0x0 iface=2(ens4) proto=0x0800 mtu=1460 len=190
0xffff8976c4b73a00      0     [<empty>(0)]              ip_rcv_core netns=4026531840 mark=0x300 iface=2(ens4) proto=0x0800 mtu=1460 len=176
0xffff8976c4b73a00      0     [<empty>(0)]             nf_hook_slow netns=4026531840 mark=0x300 iface=2(ens4) proto=0x0800 mtu=1460 len=176
0xffff8976c4b73a00      0     [<empty>(0)]    ipv4_conntrack_defrag netns=4026531840 mark=0x300 iface=2(ens4) proto=0x0800 mtu=1460 len=176
0xffff8976c4b73a00      0     [<empty>(0)]        ipv4_conntrack_in netns=4026531840 mark=0x300 iface=2(ens4) proto=0x0800 mtu=1460 len=176
0xffff8976c4b73a00      0     [<empty>(0)]          nf_conntrack_in netns=4026531840 mark=0x300 iface=2(ens4) proto=0x0800 mtu=1460 len=176
0xffff8976c4b73a00      0     [<empty>(0)]        resolve_normal_ct netns=4026531840 mark=0x300 iface=2(ens4) proto=0x0800 mtu=1460 len=176
0xffff8976c4b73a00      0     [<empty>(0)] nf_conntrack_handle_packet netns=4026531840 mark=0x300 iface=2(ens4) proto=0x0800 mtu=1460 len=176
0xffff8976c4b73a00      0     [<empty>(0)]  nf_conntrack_udp_packet netns=4026531840 mark=0x300 iface=2(ens4) proto=0x0800 mtu=1460 len=176
0xffff8976c4b73a00      0     [<empty>(0)]              nf_checksum netns=4026531840 mark=0x300 iface=2(ens4) proto=0x0800 mtu=1460 len=176
0xffff8976c4b73a00      0     [<empty>(0)]           nf_ip_checksum netns=4026531840 mark=0x300 iface=2(ens4) proto=0x0800 mtu=1460 len=176
0xffff8976c4b73a00      0     [<empty>(0)]       udp_v4_early_demux netns=4026531840 mark=0x300 iface=2(ens4) proto=0x0800 mtu=1460 len=176
0xffff8976c4b73a00      0     [<empty>(0)]     ip_route_input_noref netns=4026531840 mark=0x300 iface=2(ens4) proto=0x0800 mtu=1460 len=176
0xffff8976c4b73a00      0     [<empty>(0)]       ip_route_input_rcu netns=4026531840 mark=0x300 iface=2(ens4) proto=0x0800 mtu=1460 len=176
0xffff8976c4b73a00      0     [<empty>(0)]      ip_route_input_slow netns=4026531840 mark=0x300 iface=2(ens4) proto=0x0800 mtu=1460 len=176
0xffff8976c4b73a00      0     [<empty>(0)]      fib_validate_source netns=4026531840 mark=0x300 iface=2(ens4) proto=0x0800 mtu=1460 len=176
0xffff8976c4b73a00      0     [<empty>(0)]    __fib_validate_source netns=4026531840 mark=0x300 iface=2(ens4) proto=0x0800 mtu=1460 len=176
0xffff8976c4b73a00      0     [<empty>(0)]         ip_local_deliver netns=4026531840 mark=0x300 iface=2(ens4) proto=0x0800 mtu=1460 len=176
0xffff8976c4b73a00      0     [<empty>(0)]             nf_hook_slow netns=4026531840 mark=0x300 iface=2(ens4) proto=0x0800 mtu=1460 len=176
0xffff8976c4b73a00      0     [<empty>(0)]             ipv4_confirm netns=4026531840 mark=0x300 iface=2(ens4) proto=0x0800 mtu=1460 len=176
0xffff8976c4b73a00      0     [<empty>(0)]               nf_confirm netns=4026531840 mark=0x300 iface=2(ens4) proto=0x0800 mtu=1460 len=176
0xffff8976c4b73a00      0     [<empty>(0)]   __nf_conntrack_confirm netns=4026531840 mark=0x300 iface=2(ens4) proto=0x0800 mtu=1460 len=176
0xffff8976c4b73a00      0     [<empty>(0)]  ip_local_deliver_finish netns=4026531840 mark=0x300 iface=2(ens4) proto=0x0800 mtu=1460 len=176
0xffff8976c4b73a00      0     [<empty>(0)]  ip_protocol_deliver_rcu netns=4026531840 mark=0x300 iface=2(ens4) proto=0x0800 mtu=1460 len=156
0xffff8976c4b73a00      0     [<empty>(0)]        raw_local_deliver netns=4026531840 mark=0x300 iface=2(ens4) proto=0x0800 mtu=1460 len=156
0xffff8976c4b73a00      0     [<empty>(0)]             raw_v4_input netns=4026531840 mark=0x300 iface=2(ens4) proto=0x0800 mtu=1460 len=156
0xffff8976c4b73a00      0     [<empty>(0)]                  udp_rcv netns=4026531840 mark=0x300 iface=2(ens4) proto=0x0800 mtu=1460 len=156
0xffff8976c4b73a00      0     [<empty>(0)]           __udp4_lib_rcv netns=4026531840 mark=0x300 iface=2(ens4) proto=0x0800 mtu=1460 len=156
0xffff8976c4b73a00      0     [<empty>(0)]      udp_unicast_rcv_skb netns=4026531840 mark=0x300 iface=2(ens4) proto=0x0800 mtu=1460 len=156
0xffff8976c4b73a00      0     [<empty>(0)]        udp_queue_rcv_skb netns=4026531840 mark=0x300 iface=2(ens4) proto=0x0800 mtu=1460 len=156
0xffff8976c4b73a00      0     [<empty>(0)]    udp_queue_rcv_one_skb netns=4026531840 mark=0x300 iface=2(ens4) proto=0x0800 mtu=1460 len=156
0xffff8976c4b73a00      0     [<empty>(0)]                 skb_pull netns=4026531840 mark=0x300 iface=2(ens4) proto=0x0800 mtu=1460 len=156
0xffff8976c4b73a00      1 [kworker/1:13-wg-kex-wg0(8846)]              consume_skb netns=4026531840 mark=0x300 iface=2(ens4) proto=0x0800 mtu=1460 len=148
0xffff8976c4b73a00      1 [kworker/1:13-wg-kex-wg0(8846)]   skb_release_head_state netns=4026531840 mark=0x300 iface=2(ens4) proto=0x0800 mtu=1460 len=148
0xffff8976c4b73a00      1 [kworker/1:13-wg-kex-wg0(8846)]         skb_release_data netns=4026531840 mark=0x300 iface=2(ens4) proto=0x0800 mtu=1460 len=148
0xffff8976c4b73a00      1 [kworker/1:13-wg-kex-wg0(8846)]            skb_free_head netns=4026531840 mark=0x300 iface=2(ens4) proto=0x0800 mtu=1460 len=148
0xffff8976c4b73a00      1 [kworker/1:13-wg-kex-wg0(8846)]             kfree_skbmem netns=4026531840 mark=0x300 iface=2(ens4) proto=0x0800 mtu=1460 len=148
0xffff8976c4b73700      0     [pwru(9741)]         inet_gro_receive netns=4026531840 mark=0x0 iface=2(ens4) proto=0x0800 mtu=1460 len=124
0xffff8976c4b73700      0     [pwru(9741)]         udp4_gro_receive netns=4026531840 mark=0x0 iface=2(ens4) proto=0x0800 mtu=1460 len=124
0xffff8976c4b73700      0     [pwru(9741)]          udp_gro_receive netns=4026531840 mark=0x0 iface=2(ens4) proto=0x0800 mtu=1460 len=124
0xffff8976c4b73700      0     [pwru(9741)]   skb_defer_rx_timestamp netns=4026531840 mark=0x0 iface=2(ens4) proto=0x0800 mtu=1460 len=124
0xffff8976c4b73700      0     [pwru(9741)]             tcf_classify netns=4026531840 mark=0x0 iface=2(ens4) proto=0x0800 mtu=1460 len=124
0xffff8976c4b73700      0     [pwru(9741)]      skb_ensure_writable netns=4026531840 mark=0x0 iface=2(ens4) proto=0x0800 mtu=1460 len=138
0xffff8976c4b73700      0     [pwru(9741)]              ip_rcv_core netns=4026531840 mark=0x300 iface=2(ens4) proto=0x0800 mtu=1460 len=124
0xffff8976c4b73700      0     [pwru(9741)]             nf_hook_slow netns=4026531840 mark=0x300 iface=2(ens4) proto=0x0800 mtu=1460 len=124
0xffff8976c4b73700      0     [pwru(9741)]    ipv4_conntrack_defrag netns=4026531840 mark=0x300 iface=2(ens4) proto=0x0800 mtu=1460 len=124
0xffff8976c4b73700      0     [pwru(9741)]        ipv4_conntrack_in netns=4026531840 mark=0x300 iface=2(ens4) proto=0x0800 mtu=1460 len=124
0xffff8976c4b73700      0     [pwru(9741)]          nf_conntrack_in netns=4026531840 mark=0x300 iface=2(ens4) proto=0x0800 mtu=1460 len=124
0xffff8976c4b73700      0     [pwru(9741)]        resolve_normal_ct netns=4026531840 mark=0x300 iface=2(ens4) proto=0x0800 mtu=1460 len=124
0xffff8976c4b73700      0     [pwru(9741)] nf_conntrack_handle_packet netns=4026531840 mark=0x300 iface=2(ens4) proto=0x0800 mtu=1460 len=124
0xffff8976c4b73700      0     [pwru(9741)]  nf_conntrack_udp_packet netns=4026531840 mark=0x300 iface=2(ens4) proto=0x0800 mtu=1460 len=124
0xffff8976c4b73700      0     [pwru(9741)]              nf_checksum netns=4026531840 mark=0x300 iface=2(ens4) proto=0x0800 mtu=1460 len=124
0xffff8976c4b73700      0     [pwru(9741)]           nf_ip_checksum netns=4026531840 mark=0x300 iface=2(ens4) proto=0x0800 mtu=1460 len=124
0xffff8976c4b73700      0     [pwru(9741)]       udp_v4_early_demux netns=4026531840 mark=0x300 iface=2(ens4) proto=0x0800 mtu=1460 len=124
0xffff8976c4b73700      0     [pwru(9741)]     ip_route_input_noref netns=4026531840 mark=0x300 iface=2(ens4) proto=0x0800 mtu=1460 len=124
0xffff8976c4b73700      0     [pwru(9741)]       ip_route_input_rcu netns=4026531840 mark=0x300 iface=2(ens4) proto=0x0800 mtu=1460 len=124
0xffff8976c4b73700      0     [pwru(9741)]      ip_route_input_slow netns=4026531840 mark=0x300 iface=2(ens4) proto=0x0800 mtu=1460 len=124
0xffff8976c4b73700      0     [pwru(9741)]      fib_validate_source netns=4026531840 mark=0x300 iface=2(ens4) proto=0x0800 mtu=1460 len=124
0xffff8976c4b73700      0     [pwru(9741)]    __fib_validate_source netns=4026531840 mark=0x300 iface=2(ens4) proto=0x0800 mtu=1460 len=124
0xffff8976c4b73700      0     [pwru(9741)]         ip_local_deliver netns=4026531840 mark=0x300 iface=2(ens4) proto=0x0800 mtu=1460 len=124
0xffff8976c4b73700      0     [pwru(9741)]             nf_hook_slow netns=4026531840 mark=0x300 iface=2(ens4) proto=0x0800 mtu=1460 len=124
0xffff8976c4b73700      0     [pwru(9741)]             ipv4_confirm netns=4026531840 mark=0x300 iface=2(ens4) proto=0x0800 mtu=1460 len=124
0xffff8976c4b73700      0     [pwru(9741)]               nf_confirm netns=4026531840 mark=0x300 iface=2(ens4) proto=0x0800 mtu=1460 len=124
0xffff8976c4b73700      0     [pwru(9741)]  ip_local_deliver_finish netns=4026531840 mark=0x300 iface=2(ens4) proto=0x0800 mtu=1460 len=124
0xffff8976c4b73700      0     [pwru(9741)]  ip_protocol_deliver_rcu netns=4026531840 mark=0x300 iface=2(ens4) proto=0x0800 mtu=1460 len=104
0xffff8976c4b73700      0     [pwru(9741)]        raw_local_deliver netns=4026531840 mark=0x300 iface=2(ens4) proto=0x0800 mtu=1460 len=104
0xffff8976c4b73700      0     [pwru(9741)]             raw_v4_input netns=4026531840 mark=0x300 iface=2(ens4) proto=0x0800 mtu=1460 len=104
0xffff8976c4b73700      0     [pwru(9741)]                  udp_rcv netns=4026531840 mark=0x300 iface=2(ens4) proto=0x0800 mtu=1460 len=104
0xffff8976c4b73700      0     [pwru(9741)]           __udp4_lib_rcv netns=4026531840 mark=0x300 iface=2(ens4) proto=0x0800 mtu=1460 len=104
0xffff8976c4b73700      0     [pwru(9741)]      udp_unicast_rcv_skb netns=4026531840 mark=0x300 iface=2(ens4) proto=0x0800 mtu=1460 len=104
0xffff8976c4b73700      0     [pwru(9741)]        udp_queue_rcv_skb netns=4026531840 mark=0x300 iface=2(ens4) proto=0x0800 mtu=1460 len=104
0xffff8976c4b73700      0     [pwru(9741)]    udp_queue_rcv_one_skb netns=4026531840 mark=0x300 iface=2(ens4) proto=0x0800 mtu=1460 len=104
0xffff8976c4b73700      0     [pwru(9741)]                 skb_pull netns=4026531840 mark=0x300 iface=2(ens4) proto=0x0800 mtu=1460 len=104
0xffff8976c4b73700      0 [kworker/0:1-wg-crypt-wg0(9756)]                 skb_push netns=4026531840 mark=0x300 iface=2(ens4) proto=0x0800 mtu=1460 len=96
0xffff8976c4b73700      0 [kworker/0:1-wg-crypt-wg0(9756)]             skb_cow_data netns=4026531840 mark=0x300 iface=2(ens4) proto=0x0800 mtu=1460 len=124
0xffff8976c4b73700      0 [kworker/0:1-wg-crypt-wg0(9756)]                 skb_pull netns=4026531840 mark=0x300 iface=2(ens4) proto=0x0800 mtu=1460 len=124
0xffff8976c4b73700      0 [kworker/0:1-wg-crypt-wg0(9756)]             skb_to_sgvec netns=4026531840 mark=0x300 iface=2(ens4) proto=0x0800 mtu=1460 len=80
0xffff8976c4b73700      0 [kworker/0:1-wg-crypt-wg0(9756)]           __skb_to_sgvec netns=4026531840 mark=0x300 iface=2(ens4) proto=0x0800 mtu=1460 len=80
0xffff8976c4b73700      0 [kworker/0:1-wg-crypt-wg0(9756)]                 skb_push netns=4026531840 mark=0x300 iface=2(ens4) proto=0x0800 mtu=1460 len=80
0xffff8976c4b73700      0 [kworker/0:1-wg-crypt-wg0(9756)]                 skb_pull netns=4026531840 mark=0x300 iface=2(ens4) proto=0x0800 mtu=1460 len=108
0xffff8976c4b73700      0 [ksoftirqd/0(13)]         skb_scrub_packet netns=4026531840 mark=0x300 iface=2(ens4) proto=0x0800 mtu=1460 len=64
0xffff8976c4b73700      0 [ksoftirqd/0(13)]         napi_gro_receive netns=4026531840 mark=0x0 iface=4(wg0) proto=0x0800 mtu=1380 len=60
0xffff8976c4b73700      0 [ksoftirqd/0(13)]          dev_gro_receive netns=4026531840 mark=0x0 iface=4(wg0) proto=0x0800 mtu=1380 len=60
0xffff8976c4b73700      0 [ksoftirqd/0(13)]         inet_gro_receive netns=4026531840 mark=0x0 iface=4(wg0) proto=0x0800 mtu=1380 len=60
0xffff8976c4b73700      0 [ksoftirqd/0(13)]         tcp4_gro_receive netns=4026531840 mark=0x0 iface=4(wg0) proto=0x0800 mtu=1380 len=60
0xffff8976c4b73700      0 [ksoftirqd/0(13)]          tcp_gro_receive netns=4026531840 mark=0x0 iface=4(wg0) proto=0x0800 mtu=1380 len=60
0xffff8976c4b73700      0 [ksoftirqd/0(13)]   skb_defer_rx_timestamp netns=4026531840 mark=0x0 iface=4(wg0) proto=0x0800 mtu=1380 len=60
0xffff8976c4b73700      0 [ksoftirqd/0(13)]             tcf_classify netns=4026531840 mark=0x0 iface=4(wg0) proto=0x0800 mtu=1380 len=60
0xffff8976c4b73700      0 [ksoftirqd/0(13)]      skb_ensure_writable netns=4026531840 mark=0x0 iface=4(wg0) proto=0x0800 mtu=1380 len=60
0xffff8976c4b73700      0 [ksoftirqd/0(13)]      skb_ensure_writable netns=4026531840 mark=0x0 iface=4(wg0) proto=0x0800 mtu=1380 len=60
0xffff8976c4b73700      0 [ksoftirqd/0(13)]      skb_ensure_writable netns=4026531840 mark=0x0 iface=4(wg0) proto=0x0800 mtu=1380 len=60
0xffff8976c4b73700      0 [ksoftirqd/0(13)]      skb_ensure_writable netns=4026531840 mark=0x0 iface=4(wg0) proto=0x0800 mtu=1380 len=60
0xffff8976c4b73700      0 [ksoftirqd/0(13)] inet_proto_csum_replace_by_diff netns=4026531840 mark=0x0 iface=4(wg0) proto=0x0800 mtu=1380 len=60
0xffff8976c4b73700      0 [ksoftirqd/0(13)]      skb_ensure_writable netns=4026531840 mark=0x0 iface=4(wg0) proto=0x0800 mtu=1380 len=60
0xffff8976c4b73700      0 [ksoftirqd/0(13)] inet_proto_csum_replace4 netns=4026531840 mark=0x0 iface=4(wg0) proto=0x0800 mtu=1380 len=60
0xffff8976c4b73700      0 [ksoftirqd/0(13)]      skb_ensure_writable netns=4026531840 mark=0x0 iface=4(wg0) proto=0x0800 mtu=1380 len=60
0xffff8976c4b73700      0 [ksoftirqd/0(13)]      skb_ensure_writable netns=4026531840 mark=0x0 iface=4(wg0) proto=0x0800 mtu=1380 len=60
0xffff8976c4b73700      0 [ksoftirqd/0(13)]      skb_ensure_writable netns=4026531840 mark=0x0 iface=4(wg0) proto=0x0800 mtu=1380 len=60
0xffff8976c4b73700      0 [ksoftirqd/0(13)]      skb_ensure_writable netns=4026531840 mark=0x0 iface=4(wg0) proto=0x0800 mtu=1380 len=60
0xffff8976c4b73700      0 [ksoftirqd/0(13)]      skb_ensure_writable netns=4026531840 mark=0x0 iface=4(wg0) proto=0x0800 mtu=1380 len=60
0xffff8976c4b73700      0 [ksoftirqd/0(13)]      skb_ensure_writable netns=4026531840 mark=0x0 iface=4(wg0) proto=0x0800 mtu=1380 len=60
0xffff8976c4b73700      0 [ksoftirqd/0(13)] inet_proto_csum_replace_by_diff netns=4026531840 mark=0x0 iface=4(wg0) proto=0x0800 mtu=1380 len=60
0xffff8976c4b73700      0 [ksoftirqd/0(13)]          skb_do_redirect netns=4026531840 mark=0x300 iface=4(wg0) proto=0x0800 mtu=1380 len=60
0xffff8976c4b73700      0 [ksoftirqd/0(13)]           __bpf_redirect netns=4026531840 mark=0x300 iface=4(wg0) proto=0x0800 mtu=1380 len=60
0xffff8976c4b73700      0 [ksoftirqd/0(13)] kfree_skb_reason(SKB_DROP_REASON_NOT_SPECIFIED) netns=4026531840 mark=0x300 iface=4(wg0) proto=0x0800 mtu=1380 len=60
0xffff8976c4b73700      0 [ksoftirqd/0(13)]   skb_release_head_state netns=4026531840 mark=0x300 iface=4(wg0) proto=0x0800 mtu=1380 len=60
0xffff8976c4b73700      0 [ksoftirqd/0(13)]         skb_release_data netns=4026531840 mark=0x300 iface=4(wg0) proto=0x0800 mtu=1380 len=60
0xffff8976c4b73700      0 [ksoftirqd/0(13)]            skb_free_head netns=4026531840 mark=0x300 iface=4(wg0) proto=0x0800 mtu=1380 len=60
0xffff8976c4b73700      0 [ksoftirqd/0(13)]             kfree_skbmem netns=4026531840 mark=0x300 iface=4(wg0) proto=0x0800 mtu=1380 len=60
```

I followed this [WG troubleshooting guide](https://www.procustodibus.com/blog/2023/05/troubleshooting-wireguard-with-tcpdump/) and it looks like [forwarding the packet to the worker node/workload](https://www.procustodibus.com/blog/2023/05/troubleshooting-wireguard-with-tcpdump/#b5) is missing in the following outputs of tcpdump. The IPv4 forwarding is turned on on both nodes (k8s master and k8s worker).
The output of `tcpdump -niany udp port 51820 or host 192.168.0.2` on master node, when running `curl 192.168.0.2:30080` on VM with WG IP 192.168.0.1.

```
tcpdump: data link type LINUX_SLL2
tcpdump: verbose output suppressed, use -v[v]... for full protocol decode
listening on any, link-type LINUX_SLL2 (Linux cooked v2), snapshot length 262144 bytes
10:28:07.021793 ens4  In  IP 35.198.109.85.51820 > 10.156.0.63.51820: UDP, length 148
10:28:07.022293 ens4  Out IP 10.156.0.63.51820 > 35.198.109.85.51820: UDP, length 92
10:28:07.023598 ens4  In  IP 35.198.109.85.51820 > 10.156.0.63.51820: UDP, length 96
10:28:07.023699 wg0   In  IP 192.168.0.1.41438 > 192.168.0.2.30080: Flags [S], seq 593549822, win 64320, options [mss 1340,sackOK,TS val 3507084598 ecr 0,nop,wscale 7], length 0
```

The output of `tcpdump -niany udp port 51820 or host 192.168.0.2` on VM with WG IP 192.168.0.1, when running `curl 192.168.0.2:30080` on that VM (192.168.0.1)

```
tcpdump: data link type LINUX_SLL2
tcpdump: verbose output suppressed, use -v[v]... for full protocol decode
listening on any, link-type LINUX_SLL2 (Linux cooked v2), snapshot length 262144 bytes
10:28:07.020569 wg0   Out IP 192.168.0.1.41438 > 192.168.0.2.30080: Flags [S], seq 593549822, win 64320, options [mss 1340,sackOK,TS val 3507084598 ecr 0,nop,wscale 7], length 0
10:28:07.020790 ens4  Out IP 10.156.0.61.51820 > 35.246.246.227.51820: UDP, length 148
10:28:07.023108 ens4  In  IP 35.246.246.227.51820 > 10.156.0.61.51820: UDP, length 92
10:28:07.023351 ens4  Out IP 10.156.0.61.51820 > 35.246.246.227.51820: UDP, length 96
10:28:08.045812 wg0   Out IP 192.168.0.1.41438 > 192.168.0.2.30080: Flags [S], seq 593549822, win 64320, options [mss 1340,sackOK,TS val 3507085623 ecr 0,nop,wscale 7], length 0
```

The tcpdump caught zero packets on the worker node, where the actual workload that the `curl 192.168.0.2:30080` cmd is trying to access runs.

In that troubleshooting guide, a guy is saying that it should be a problem with firewall, IPv4 forwarding turned off or a missing route to the endpoint, so just in case I am attaching outputs of `iptables -L -v` and `ip route get 192.168.0.2`.

```
Chain INPUT (policy ACCEPT 0 packets, 0 bytes)
 pkts bytes target     prot opt in     out     source               destination         
1517K  237M CILIUM_INPUT  all  --  any    any     anywhere             anywhere             /* cilium-feeder: CILIUM_INPUT */
1582K  483M KUBE-FIREWALL  all  --  any    any     anywhere             anywhere            

Chain FORWARD (policy DROP 0 packets, 0 bytes)
 pkts bytes target     prot opt in     out     source               destination         
   14  1962 CILIUM_FORWARD  all  --  any    any     anywhere             anywhere             /* cilium-feeder: CILIUM_FORWARD */
    0     0 DOCKER-USER  all  --  any    any     anywhere             anywhere            
    0     0 DOCKER-ISOLATION-STAGE-1  all  --  any    any     anywhere             anywhere            
    0     0 ACCEPT     all  --  any    docker0  anywhere             anywhere             ctstate RELATED,ESTABLISHED
    0     0 DOCKER     all  --  any    docker0  anywhere             anywhere            
    0     0 ACCEPT     all  --  docker0 !docker0  anywhere             anywhere            
    0     0 ACCEPT     all  --  docker0 docker0  anywhere             anywhere            

Chain OUTPUT (policy ACCEPT 0 packets, 0 bytes)
 pkts bytes target     prot opt in     out     source               destination         
1517K  245M CILIUM_OUTPUT  all  --  any    any     anywhere             anywhere             /* cilium-feeder: CILIUM_OUTPUT */
1575K  272M KUBE-FIREWALL  all  --  any    any     anywhere             anywhere            

Chain CILIUM_FORWARD (1 references)
 pkts bytes target     prot opt in     out     source               destination         
    8  1294 ACCEPT     all  --  any    cilium_host  anywhere             anywhere             /* cilium: any->cluster on cilium_host forward accept */
    0     0 ACCEPT     all  --  cilium_host any     anywhere             anywhere             /* cilium: cluster->any on cilium_host forward accept (nodeport) */
    6   668 ACCEPT     all  --  lxc+   any     anywhere             anywhere             /* cilium: cluster->any on lxc+ forward accept */
    0     0 ACCEPT     all  --  cilium_net any     anywhere             anywhere             /* cilium: cluster->any on cilium_net forward accept (nodeport) */

Chain CILIUM_INPUT (1 references)
 pkts bytes target     prot opt in     out     source               destination         
    0     0 ACCEPT     all  --  any    any     anywhere             anywhere             /* cilium: ACCEPT for proxy traffic */

Chain CILIUM_OUTPUT (1 references)
 pkts bytes target     prot opt in     out     source               destination         
    0     0 ACCEPT     all  --  any    any     anywhere             anywhere             /* cilium: ACCEPT for proxy return traffic */
    0     0 ACCEPT     all  --  any    any     anywhere             anywhere             /* cilium: ACCEPT for l7 proxy upstream traffic */
1517K  245M MARK       all  --  any    any     anywhere             anywhere             /* cilium: host->any mark as from host */ MARK xset 0xc00/0xf00

Chain DOCKER (1 references)
 pkts bytes target     prot opt in     out     source               destination         

Chain DOCKER-ISOLATION-STAGE-1 (1 references)
 pkts bytes target     prot opt in     out     source               destination         
    0     0 DOCKER-ISOLATION-STAGE-2  all  --  docker0 !docker0  anywhere             anywhere            
    0     0 RETURN     all  --  any    any     anywhere             anywhere            

Chain DOCKER-ISOLATION-STAGE-2 (1 references)
 pkts bytes target     prot opt in     out     source               destination         
    0     0 DROP       all  --  any    docker0  anywhere             anywhere            
    0     0 RETURN     all  --  any    any     anywhere             anywhere            

Chain DOCKER-USER (1 references)
 pkts bytes target     prot opt in     out     source               destination         
    0     0 RETURN     all  --  any    any     anywhere             anywhere            

Chain KUBE-FIREWALL (2 references)
 pkts bytes target     prot opt in     out     source               destination         
    0     0 DROP       all  --  any    any    !localhost/8          localhost/8          /* block incoming localnet connections */ ! ctstate RELATED,ESTABLISHED,DNAT

Chain KUBE-KUBELET-CANARY (0 references)
 pkts bytes target     prot opt in     out     source               destination      
```

```
$ ip route get 192.168.0.2
local 192.168.0.2 dev lo table local src 192.168.0.2 uid 0 
    cache <local> 
```

Could you please take a look once again, in case you find some time?

**Comment by JKBGIT1** [comment]
Hi, found some additional information that might be useful (haven't noticed before that `pwru` supports displaying the IP addresses 😅 ).

Before Wireguard drops the packet it applies the following changes to it:

1. Change the destination IP from 192.168.0.2 (master node WG IP) to 10.0.0.17 (Pod IP with the running backend application)
2. Change the destination port from 30080 (nodePort of the backend) to 80 (targetPort of the backend)
3. Change the source IP from 192.168.0.1 (Wireguard IP of a VM that isn't in the k8s cluster) to 10.0.1.144 (CILIUMINTERNALIP of the master node)
```
root@jakub-playground-1:~# kubectl get ciliumnodes.cilium.io
NAME                 CILIUMINTERNALIP   INTERNALIP      AGE
jakub-playground-1   10.0.1.144         10.156.15.201   6h50m
jakub-playground-2   10.0.0.183         10.156.15.200   6h50m
```

You can see everything I mentioned in the following output that is from `pwru 'port 30080 or port 51820' --output-meta --output-tuple  --filter-track-skb` ran on the master node (WG IP 192.168.0.2), while the `curl 192.168.0.3:30080` were ran from a VM with WG IP 192.168.0.1

```
2024/01/31 14:12:39 Attaching kprobes (via kprobe)...
1579 / 1576 [--------------------------------------------------------------------------------------------------------------------------------------------------------------------------------------] 100.19% 45 p/s
2024/01/31 14:13:15 Attached (ignored 0)
2024/01/31 14:13:15 Listening for events..
               SKB    CPU          PROCESS                     FUNC
0xffff973fd1540f00      0     [<empty>(0)]         inet_gro_receive netns=4026531840 mark=0x0 iface=2(ens4) proto=0x0800 mtu=1460 len=176 35.198.139.208:51820->10.156.15.201:51820(udp)
0xffff973fd1540f00      0     [<empty>(0)]         udp4_gro_receive netns=4026531840 mark=0x0 iface=2(ens4) proto=0x0800 mtu=1460 len=176 35.198.139.208:51820->10.156.15.201:51820(udp)
0xffff973fd1540f00      0     [<empty>(0)]          udp_gro_receive netns=4026531840 mark=0x0 iface=2(ens4) proto=0x0800 mtu=1460 len=176 35.198.139.208:51820->10.156.15.201:51820(udp)
0xffff973fd1540f00      0     [<empty>(0)]   skb_defer_rx_timestamp netns=4026531840 mark=0x0 iface=2(ens4) proto=0x0800 mtu=1460 len=176 35.198.139.208:51820->10.156.15.201:51820(udp)
0xffff973fd1540f00      0     [<empty>(0)]             tcf_classify netns=4026531840 mark=0x0 iface=2(ens4) proto=0x0800 mtu=1460 len=176 35.198.139.208:51820->10.156.15.201:51820(udp)
0xffff973fd1540f00      0     [<empty>(0)]      skb_ensure_writable netns=4026531840 mark=0x0 iface=2(ens4) proto=0x0800 mtu=1460 len=190 35.198.139.208:51820->10.156.15.201:51820(udp)
0xffff973fd1540f00      0     [<empty>(0)]              ip_rcv_core netns=4026531840 mark=0x300 iface=2(ens4) proto=0x0800 mtu=1460 len=176 35.198.139.208:51820->10.156.15.201:51820(udp)
0xffff973fd1540f00      0     [<empty>(0)]             nf_hook_slow netns=4026531840 mark=0x300 iface=2(ens4) proto=0x0800 mtu=1460 len=176 35.198.139.208:51820->10.156.15.201:51820(udp)
0xffff973fd1540f00      0     [<empty>(0)]    ipv4_conntrack_defrag netns=4026531840 mark=0x300 iface=2(ens4) proto=0x0800 mtu=1460 len=176 35.198.139.208:51820->10.156.15.201:51820(udp)
0xffff973fd1540f00      0     [<empty>(0)]        ipv4_conntrack_in netns=4026531840 mark=0x300 iface=2(ens4) proto=0x0800 mtu=1460 len=176 35.198.139.208:51820->10.156.15.201:51820(udp)
0xffff973fd1540f00      0     [<empty>(0)]          nf_conntrack_in netns=4026531840 mark=0x300 iface=2(ens4) proto=0x0800 mtu=1460 len=176 35.198.139.208:51820->10.156.15.201:51820(udp)
0xffff973fd1540f00      0     [<empty>(0)]        resolve_normal_ct netns=4026531840 mark=0x300 iface=2(ens4) proto=0x0800 mtu=1460 len=176 35.198.139.208:51820->10.156.15.201:51820(udp)
0xffff973fd1540f00      0     [<empty>(0)] nf_conntrack_handle_packet netns=4026531840 mark=0x300 iface=2(ens4) proto=0x0800 mtu=1460 len=176 35.198.139.208:51820->10.156.15.201:51820(udp)
0xffff973fd1540f00      0     [<empty>(0)]  nf_conntrack_udp_packet netns=4026531840 mark=0x300 iface=2(ens4) proto=0x0800 mtu=1460 len=176 35.198.139.208:51820->10.156.15.201:51820(udp)
0xffff973fd1540f00      0     [<empty>(0)]              nf_checksum netns=4026531840 mark=0x300 iface=2(ens4) proto=0x0800 mtu=1460 len=176 35.198.139.208:51820->10.156.15.201:51820(udp)
0xffff973fd1540f00      0     [<empty>(0)]           nf_ip_checksum netns=4026531840 mark=0x300 iface=2(ens4) proto=0x0800 mtu=1460 len=176 35.198.139.208:51820->10.156.15.201:51820(udp)
0xffff973fd1540f00      0     [<empty>(0)]       udp_v4_early_demux netns=4026531840 mark=0x300 iface=2(ens4) proto=0x0800 mtu=1460 len=176 35.198.139.208:51820->10.156.15.201:51820(udp)
0xffff973fd1540f00      0     [<empty>(0)]     ip_route_input_noref netns=4026531840 mark=0x300 iface=2(ens4) proto=0x0800 mtu=1460 len=176 35.198.139.208:51820->10.156.15.201:51820(udp)
0xffff973fd1540f00      0     [<empty>(0)]       ip_route_input_rcu netns=4026531840 mark=0x300 iface=2(ens4) proto=0x0800 mtu=1460 len=176 35.198.139.208:51820->10.156.15.201:51820(udp)
0xffff973fd1540f00      0     [<empty>(0)]      ip_route_input_slow netns=4026531840 mark=0x300 iface=2(ens4) proto=0x0800 mtu=1460 len=176 35.198.139.208:51820->10.156.15.201:51820(udp)
0xffff973fd1540f00      0     [<empty>(0)]      fib_validate_source netns=4026531840 mark=0x300 iface=2(ens4) proto=0x0800 mtu=1460 len=176 35.198.139.208:51820->10.156.15.201:51820(udp)
0xffff973fd1540f00      0     [<empty>(0)]    __fib_validate_source netns=4026531840 mark=0x300 iface=2(ens4) proto=0x0800 mtu=1460 len=176 35.198.139.208:51820->10.156.15.201:51820(udp)
0xffff973fd1540f00      0     [<empty>(0)]         ip_local_deliver netns=4026531840 mark=0x300 iface=2(ens4) proto=0x0800 mtu=1460 len=176 35.198.139.208:51820->10.156.15.201:51820(udp)
0xffff973fd1540f00      0     [<empty>(0)]             nf_hook_slow netns=4026531840 mark=0x300 iface=2(ens4) proto=0x0800 mtu=1460 len=176 35.198.139.208:51820->10.156.15.201:51820(udp)
0xffff973fd1540f00      0     [<empty>(0)]             ipv4_confirm netns=4026531840 mark=0x300 iface=2(ens4) proto=0x0800 mtu=1460 len=176 35.198.139.208:51820->10.156.15.201:51820(udp)
0xffff973fd1540f00      0     [<empty>(0)]               nf_confirm netns=4026531840 mark=0x300 iface=2(ens4) proto=0x0800 mtu=1460 len=176 35.198.139.208:51820->10.156.15.201:51820(udp)
0xffff973fd1540f00      0     [<empty>(0)]   __nf_conntrack_confirm netns=4026531840 mark=0x300 iface=2(ens4) proto=0x0800 mtu=1460 len=176 35.198.139.208:51820->10.156.15.201:51820(udp)
0xffff973fd1540f00      0     [<empty>(0)]  ip_local_deliver_finish netns=4026531840 mark=0x300 iface=2(ens4) proto=0x0800 mtu=1460 len=176 35.198.139.208:51820->10.156.15.201:51820(udp)
0xffff973fd1540f00      0     [<empty>(0)]  ip_protocol_deliver_rcu netns=4026531840 mark=0x300 iface=2(ens4) proto=0x0800 mtu=1460 len=156 35.198.139.208:51820->10.156.15.201:51820(udp)
0xffff973fd1540f00      0     [<empty>(0)]        raw_local_deliver netns=4026531840 mark=0x300 iface=2(ens4) proto=0x0800 mtu=1460 len=156 35.198.139.208:51820->10.156.15.201:51820(udp)
0xffff973fd1540f00      0     [<empty>(0)]             raw_v4_input netns=4026531840 mark=0x300 iface=2(ens4) proto=0x0800 mtu=1460 len=156 35.198.139.208:51820->10.156.15.201:51820(udp)
0xffff973fd1540f00      0     [<empty>(0)]                  udp_rcv netns=4026531840 mark=0x300 iface=2(ens4) proto=0x0800 mtu=1460 len=156 35.198.139.208:51820->10.156.15.201:51820(udp)
0xffff973fd1540f00      0     [<empty>(0)]           __udp4_lib_rcv netns=4026531840 mark=0x300 iface=2(ens4) proto=0x0800 mtu=1460 len=156 35.198.139.208:51820->10.156.15.201:51820(udp)
0xffff973fd1540f00      0     [<empty>(0)]      udp_unicast_rcv_skb netns=4026531840 mark=0x300 iface=2(ens4) proto=0x0800 mtu=1460 len=156 35.198.139.208:51820->10.156.15.201:51820(udp)
0xffff973fd1540f00      0     [<empty>(0)]        udp_queue_rcv_skb netns=4026531840 mark=0x300 iface=2(ens4) proto=0x0800 mtu=1460 len=156 35.198.139.208:51820->10.156.15.201:51820(udp)
0xffff973fd1540f00      0     [<empty>(0)]    udp_queue_rcv_one_skb netns=4026531840 mark=0x300 iface=2(ens4) proto=0x0800 mtu=1460 len=156 35.198.139.208:51820->10.156.15.201:51820(udp)
0xffff973fd1540f00      0     [<empty>(0)]                 skb_pull netns=4026531840 mark=0x300 iface=2(ens4) proto=0x0800 mtu=1460 len=156 35.198.139.208:51820->10.156.15.201:51820(udp)
0xffff973fd1540600      0 [kworker/0:2-wg-crypt-wg0(12744)]             ip_local_out netns=4026531840 mark=0x0 iface=3(wg0) proto=0x0000 mtu=1380 len=120 10.156.15.201:51820->35.198.139.208:51820(udp)
0xffff973fd1540600      0 [kworker/0:2-wg-crypt-wg0(12744)]           __ip_local_out netns=4026531840 mark=0x0 iface=3(wg0) proto=0x0000 mtu=1380 len=120 10.156.15.201:51820->35.198.139.208:51820(udp)
0xffff973fd1540600      0 [kworker/0:2-wg-crypt-wg0(12744)]             nf_hook_slow netns=4026531840 mark=0x0 iface=3(wg0) proto=0x0800 mtu=1380 len=120 10.156.15.201:51820->35.198.139.208:51820(udp)
0xffff973fd1540600      0 [kworker/0:2-wg-crypt-wg0(12744)]    ipv4_conntrack_defrag netns=4026531840 mark=0x0 iface=3(wg0) proto=0x0800 mtu=1380 len=120 10.156.15.201:51820->35.198.139.208:51820(udp)
0xffff973fd1540600      0 [kworker/0:2-wg-crypt-wg0(12744)]     ipv4_conntrack_local netns=4026531840 mark=0x0 iface=3(wg0) proto=0x0800 mtu=1380 len=120 10.156.15.201:51820->35.198.139.208:51820(udp)
0xffff973fd1540600      0 [kworker/0:2-wg-crypt-wg0(12744)]          nf_conntrack_in netns=4026531840 mark=0x0 iface=3(wg0) proto=0x0800 mtu=1380 len=120 10.156.15.201:51820->35.198.139.208:51820(udp)
0xffff973fd1540600      0 [kworker/0:2-wg-crypt-wg0(12744)]        resolve_normal_ct netns=4026531840 mark=0x0 iface=3(wg0) proto=0x0800 mtu=1380 len=120 10.156.15.201:51820->35.198.139.208:51820(udp)
0xffff973fd1540600      0 [kworker/0:2-wg-crypt-wg0(12744)] nf_conntrack_handle_packet netns=4026531840 mark=0x0 iface=3(wg0) proto=0x0800 mtu=1380 len=120 10.156.15.201:51820->35.198.139.208:51820(udp)
0xffff973fd1540600      0 [kworker/0:2-wg-crypt-wg0(12744)]  nf_conntrack_udp_packet netns=4026531840 mark=0x0 iface=3(wg0) proto=0x0800 mtu=1380 len=120 10.156.15.201:51820->35.198.139.208:51820(udp)
0xffff973fd1540600      0 [kworker/0:2-wg-crypt-wg0(12744)]                ip_output netns=4026531840 mark=0xc00 iface=3(wg0) proto=0x0800 mtu=1380 len=120 10.156.15.201:51820->35.198.139.208:51820(udp)
0xffff973fd1540600      0 [kworker/0:2-wg-crypt-wg0(12744)]             nf_hook_slow netns=4026531840 mark=0xc00 iface=2(ens4) proto=0x0800 mtu=1460 len=120 10.156.15.201:51820->35.198.139.208:51820(udp)
0xffff973fd1540600      0 [kworker/0:2-wg-crypt-wg0(12744)]  apparmor_ipv4_postroute netns=4026531840 mark=0xc00 iface=2(ens4) proto=0x0800 mtu=1460 len=120 10.156.15.201:51820->35.198.139.208:51820(udp)
0xffff973fd1540600      0 [kworker/0:2-wg-crypt-wg0(12744)]             ipv4_confirm netns=4026531840 mark=0xc00 iface=2(ens4) proto=0x0800 mtu=1460 len=120 10.156.15.201:51820->35.198.139.208:51820(udp)
0xffff973fd1540600      0 [kworker/0:2-wg-crypt-wg0(12744)]               nf_confirm netns=4026531840 mark=0xc00 iface=2(ens4) proto=0x0800 mtu=1460 len=120 10.156.15.201:51820->35.198.139.208:51820(udp)
0xffff973fd1540600      0 [kworker/0:2-wg-crypt-wg0(12744)]         ip_finish_output netns=4026531840 mark=0xc00 iface=2(ens4) proto=0x0800 mtu=1460 len=120 10.156.15.201:51820->35.198.139.208:51820(udp)
0xffff973fd1540600      0 [kworker/0:2-wg-crypt-wg0(12744)]       __ip_finish_output netns=4026531840 mark=0xc00 iface=2(ens4) proto=0x0800 mtu=1460 len=120 10.156.15.201:51820->35.198.139.208:51820(udp)
0xffff973fd1540600      0 [kworker/0:2-wg-crypt-wg0(12744)]        ip_finish_output2 netns=4026531840 mark=0xc00 iface=2(ens4) proto=0x0800 mtu=1460 len=120 10.156.15.201:51820->35.198.139.208:51820(udp)
0xffff973fd1540600      0 [kworker/0:2-wg-crypt-wg0(12744)]           dev_queue_xmit netns=4026531840 mark=0xc00 iface=2(ens4) proto=0x0800 mtu=1460 len=134 10.156.15.201:51820->35.198.139.208:51820(udp)
0xffff973fd1540600      0 [kworker/0:2-wg-crypt-wg0(12744)]         __dev_queue_xmit netns=4026531840 mark=0xc00 iface=2(ens4) proto=0x0800 mtu=1460 len=134 10.156.15.201:51820->35.198.139.208:51820(udp)
0xffff973fd1540600      0 [kworker/0:2-wg-crypt-wg0(12744)]       qdisc_pkt_len_init netns=4026531840 mark=0xc00 iface=2(ens4) proto=0x0800 mtu=1460 len=134 10.156.15.201:51820->35.198.139.208:51820(udp)
0xffff973fd1540600      0 [kworker/0:2-wg-crypt-wg0(12744)]             tcf_classify netns=4026531840 mark=0xc00 iface=2(ens4) proto=0x0800 mtu=1460 len=134 10.156.15.201:51820->35.198.139.208:51820(udp)
0xffff973fd1540600      0 [kworker/0:2-wg-crypt-wg0(12744)]      netdev_core_pick_tx netns=4026531840 mark=0x300 iface=2(ens4) proto=0x0800 mtu=1460 len=134 10.156.15.201:51820->35.198.139.208:51820(udp)
0xffff973fd1540600      0 [kworker/0:2-wg-crypt-wg0(12744)]           netdev_pick_tx netns=4026531840 mark=0x300 iface=2(ens4) proto=0x0800 mtu=1460 len=134 10.156.15.201:51820->35.198.139.208:51820(udp)
0xffff973fd1540600      0 [kworker/0:2-wg-crypt-wg0(12744)]      __get_xps_queue_idx netns=4026531840 mark=0x300 iface=2(ens4) proto=0x0800 mtu=1460 len=134 10.156.15.201:51820->35.198.139.208:51820(udp)
0xffff973fd1540600      0 [kworker/0:2-wg-crypt-wg0(12744)]          sch_direct_xmit netns=4026531840 mark=0x300 iface=2(ens4) proto=0x0800 mtu=1460 len=134 10.156.15.201:51820->35.198.139.208:51820(udp)
0xffff973fd1540600      0 [kworker/0:2-wg-crypt-wg0(12744)]   validate_xmit_skb_list netns=4026531840 mark=0x300 iface=2(ens4) proto=0x0800 mtu=1460 len=134 10.156.15.201:51820->35.198.139.208:51820(udp)
0xffff973fd1540600      0 [kworker/0:2-wg-crypt-wg0(12744)]        validate_xmit_skb netns=4026531840 mark=0x300 iface=2(ens4) proto=0x0800 mtu=1460 len=134 10.156.15.201:51820->35.198.139.208:51820(udp)
0xffff973fd1540600      0 [kworker/0:2-wg-crypt-wg0(12744)]       netif_skb_features netns=4026531840 mark=0x300 iface=2(ens4) proto=0x0800 mtu=1460 len=134 10.156.15.201:51820->35.198.139.208:51820(udp)
0xffff973fd1540600      0 [kworker/0:2-wg-crypt-wg0(12744)]  passthru_features_check netns=4026531840 mark=0x300 iface=2(ens4) proto=0x0800 mtu=1460 len=134 10.156.15.201:51820->35.198.139.208:51820(udp)
0xffff973fd1540600      0 [kworker/0:2-wg-crypt-wg0(12744)]     skb_network_protocol netns=4026531840 mark=0x300 iface=2(ens4) proto=0x0800 mtu=1460 len=134 10.156.15.201:51820->35.198.139.208:51820(udp)
0xffff973fd1540600      0 [kworker/0:2-wg-crypt-wg0(12744)]       validate_xmit_vlan netns=4026531840 mark=0x300 iface=2(ens4) proto=0x0800 mtu=1460 len=134 10.156.15.201:51820->35.198.139.208:51820(udp)
0xffff973fd1540600      0 [kworker/0:2-wg-crypt-wg0(12744)]  skb_csum_hwoffload_help netns=4026531840 mark=0x300 iface=2(ens4) proto=0x0800 mtu=1460 len=134 10.156.15.201:51820->35.198.139.208:51820(udp)
0xffff973fd1540600      0 [kworker/0:2-wg-crypt-wg0(12744)]       validate_xmit_xfrm netns=4026531840 mark=0x300 iface=2(ens4) proto=0x0800 mtu=1460 len=134 10.156.15.201:51820->35.198.139.208:51820(udp)
0xffff973fd1540600      0 [kworker/0:2-wg-crypt-wg0(12744)]      dev_hard_start_xmit netns=4026531840 mark=0x300 iface=2(ens4) proto=0x0800 mtu=1460 len=134 10.156.15.201:51820->35.198.139.208:51820(udp)
0xffff973fd1540600      0 [kworker/0:2-wg-crypt-wg0(12744)]   skb_clone_tx_timestamp netns=4026531840 mark=0x300 iface=2(ens4) proto=0x0800 mtu=1460 len=134 10.156.15.201:51820->35.198.139.208:51820(udp)
0xffff973fd1540600      0 [kworker/0:2-wg-crypt-wg0(12744)]             skb_to_sgvec netns=4026531840 mark=0x300 iface=2(ens4) proto=0x0800 mtu=1460 len=134 10.156.15.201:51820->35.198.139.208:51820(udp)
0xffff973fd1540600      0 [kworker/0:2-wg-crypt-wg0(12744)]           __skb_to_sgvec netns=4026531840 mark=0x300 iface=2(ens4) proto=0x0800 mtu=1460 len=134 10.156.15.201:51820->35.198.139.208:51820(udp)
0xffff973fd1540f00      0 [kworker/0:2-wg-crypt-wg0(12744)]              consume_skb netns=4026531840 mark=0x300 iface=2(ens4) proto=0x0800 mtu=1460 len=148 35.198.139.208:51820->10.156.15.201:51820(udp)
0xffff973fd1540f00      0 [kworker/0:2-wg-crypt-wg0(12744)]   skb_release_head_state netns=4026531840 mark=0x300 iface=2(ens4) proto=0x0800 mtu=1460 len=148 35.198.139.208:51820->10.156.15.201:51820(udp)
0xffff973fd1540f00      0 [kworker/0:2-wg-crypt-wg0(12744)]         skb_release_data netns=4026531840 mark=0x300 iface=2(ens4) proto=0x0800 mtu=1460 len=148 35.198.139.208:51820->10.156.15.201:51820(udp)
0xffff973fd1540f00      0 [kworker/0:2-wg-crypt-wg0(12744)]            skb_free_head netns=4026531840 mark=0x300 iface=2(ens4) proto=0x0800 mtu=1460 len=148 35.198.139.208:51820->10.156.15.201:51820(udp)
0xffff973fd1540f00      0 [kworker/0:2-wg-crypt-wg0(12744)]             kfree_skbmem netns=4026531840 mark=0x300 iface=2(ens4) proto=0x0800 mtu=1460 len=148 35.198.139.208:51820->10.156.15.201:51820(udp)
0xffff973fd1540600      0    [pwru(19419)]         napi_consume_skb netns=4026531840 mark=0x300 iface=2(ens4) proto=0x0800 mtu=1460 len=134 10.156.15.201:51820->35.198.139.208:51820(udp)
0xffff973fd1540600      0    [pwru(19419)]   skb_release_head_state netns=4026531840 mark=0x300 iface=2(ens4) proto=0x0800 mtu=1460 len=134 10.156.15.201:51820->35.198.139.208:51820(udp)
0xffff973fd1540600      0    [pwru(19419)]         skb_release_data netns=4026531840 mark=0x300 iface=2(ens4) proto=0x0800 mtu=1460 len=134 10.156.15.201:51820->35.198.139.208:51820(udp)
0xffff973fd1540600      0    [pwru(19419)]            skb_free_head netns=4026531840 mark=0x300 iface=2(ens4) proto=0x0800 mtu=1460 len=134 10.156.15.201:51820->35.198.139.208:51820(udp)
0xffff973fd1540f00      0    [pwru(19419)]         inet_gro_receive netns=4026531840 mark=0x0 iface=2(ens4) proto=0x0800 mtu=1460 len=124 35.198.139.208:51820->10.156.15.201:51820(udp)
0xffff973fd1540f00      0    [pwru(19419)]         udp4_gro_receive netns=4026531840 mark=0x0 iface=2(ens4) proto=0x0800 mtu=1460 len=124 35.198.139.208:51820->10.156.15.201:51820(udp)
0xffff973fd1540f00      0    [pwru(19419)]          udp_gro_receive netns=4026531840 mark=0x0 iface=2(ens4) proto=0x0800 mtu=1460 len=124 35.198.139.208:51820->10.156.15.201:51820(udp)
0xffff973fd1540f00      0    [pwru(19419)]   skb_defer_rx_timestamp netns=4026531840 mark=0x0 iface=2(ens4) proto=0x0800 mtu=1460 len=124 35.198.139.208:51820->10.156.15.201:51820(udp)
0xffff973fd1540f00      0    [pwru(19419)]             tcf_classify netns=4026531840 mark=0x0 iface=2(ens4) proto=0x0800 mtu=1460 len=124 35.198.139.208:51820->10.156.15.201:51820(udp)
0xffff973fd1540f00      0    [pwru(19419)]      skb_ensure_writable netns=4026531840 mark=0x0 iface=2(ens4) proto=0x0800 mtu=1460 len=138 35.198.139.208:51820->10.156.15.201:51820(udp)
0xffff973fd1540f00      0    [pwru(19419)]              ip_rcv_core netns=4026531840 mark=0x300 iface=2(ens4) proto=0x0800 mtu=1460 len=124 35.198.139.208:51820->10.156.15.201:51820(udp)
0xffff973fd1540f00      0    [pwru(19419)]             nf_hook_slow netns=4026531840 mark=0x300 iface=2(ens4) proto=0x0800 mtu=1460 len=124 35.198.139.208:51820->10.156.15.201:51820(udp)
0xffff973fd1540f00      0    [pwru(19419)]    ipv4_conntrack_defrag netns=4026531840 mark=0x300 iface=2(ens4) proto=0x0800 mtu=1460 len=124 35.198.139.208:51820->10.156.15.201:51820(udp)
0xffff973fd1540f00      0    [pwru(19419)]        ipv4_conntrack_in netns=4026531840 mark=0x300 iface=2(ens4) proto=0x0800 mtu=1460 len=124 35.198.139.208:51820->10.156.15.201:51820(udp)
0xffff973fd1540f00      0    [pwru(19419)]          nf_conntrack_in netns=4026531840 mark=0x300 iface=2(ens4) proto=0x0800 mtu=1460 len=124 35.198.139.208:51820->10.156.15.201:51820(udp)
0xffff973fd1540f00      0    [pwru(19419)]        resolve_normal_ct netns=4026531840 mark=0x300 iface=2(ens4) proto=0x0800 mtu=1460 len=124 35.198.139.208:51820->10.156.15.201:51820(udp)
0xffff973fd1540f00      0    [pwru(19419)] nf_conntrack_handle_packet netns=4026531840 mark=0x300 iface=2(ens4) proto=0x0800 mtu=1460 len=124 35.198.139.208:51820->10.156.15.201:51820(udp)
0xffff973fd1540f00      0    [pwru(19419)]  nf_conntrack_udp_packet netns=4026531840 mark=0x300 iface=2(ens4) proto=0x0800 mtu=1460 len=124 35.198.139.208:51820->10.156.15.201:51820(udp)
0xffff973fd1540f00      0    [pwru(19419)]              nf_checksum netns=4026531840 mark=0x300 iface=2(ens4) proto=0x0800 mtu=1460 len=124 35.198.139.208:51820->10.156.15.201:51820(udp)
0xffff973fd1540f00      0    [pwru(19419)]           nf_ip_checksum netns=4026531840 mark=0x300 iface=2(ens4) proto=0x0800 mtu=1460 len=124 35.198.139.208:51820->10.156.15.201:51820(udp)
0xffff973fd1540f00      0    [pwru(19419)]       udp_v4_early_demux netns=4026531840 mark=0x300 iface=2(ens4) proto=0x0800 mtu=1460 len=124 35.198.139.208:51820->10.156.15.201:51820(udp)
0xffff973fd1540f00      0    [pwru(19419)]     ip_route_input_noref netns=4026531840 mark=0x300 iface=2(ens4) proto=0x0800 mtu=1460 len=124 35.198.139.208:51820->10.156.15.201:51820(udp)
0xffff973fd1540f00      0    [pwru(19419)]       ip_route_input_rcu netns=4026531840 mark=0x300 iface=2(ens4) proto=0x0800 mtu=1460 len=124 35.198.139.208:51820->10.156.15.201:51820(udp)
0xffff973fd1540f00      0    [pwru(19419)]      ip_route_input_slow netns=4026531840 mark=0x300 iface=2(ens4) proto=0x0800 mtu=1460 len=124 35.198.139.208:51820->10.156.15.201:51820(udp)
0xffff973fd1540f00      0    [pwru(19419)]      fib_validate_source netns=4026531840 mark=0x300 iface=2(ens4) proto=0x0800 mtu=1460 len=124 35.198.139.208:51820->10.156.15.201:51820(udp)
0xffff973fd1540f00      0    [pwru(19419)]    __fib_validate_source netns=4026531840 mark=0x300 iface=2(ens4) proto=0x0800 mtu=1460 len=124 35.198.139.208:51820->10.156.15.201:51820(udp)
0xffff973fd1540f00      0    [pwru(19419)]         ip_local_deliver netns=4026531840 mark=0x300 iface=2(ens4) proto=0x0800 mtu=1460 len=124 35.198.139.208:51820->10.156.15.201:51820(udp)
0xffff973fd1540f00      0    [pwru(19419)]             nf_hook_slow netns=4026531840 mark=0x300 iface=2(ens4) proto=0x0800 mtu=1460 len=124 35.198.139.208:51820->10.156.15.201:51820(udp)
0xffff973fd1540f00      0    [pwru(19419)]             ipv4_confirm netns=4026531840 mark=0x300 iface=2(ens4) proto=0x0800 mtu=1460 len=124 35.198.139.208:51820->10.156.15.201:51820(udp)
0xffff973fd1540f00      0    [pwru(19419)]               nf_confirm netns=4026531840 mark=0x300 iface=2(ens4) proto=0x0800 mtu=1460 len=124 35.198.139.208:51820->10.156.15.201:51820(udp)
0xffff973fd1540f00      0    [pwru(19419)]  ip_local_deliver_finish netns=4026531840 mark=0x300 iface=2(ens4) proto=0x0800 mtu=1460 len=124 35.198.139.208:51820->10.156.15.201:51820(udp)
0xffff973fd1540f00      0    [pwru(19419)]  ip_protocol_deliver_rcu netns=4026531840 mark=0x300 iface=2(ens4) proto=0x0800 mtu=1460 len=104 35.198.139.208:51820->10.156.15.201:51820(udp)
0xffff973fd1540f00      0    [pwru(19419)]        raw_local_deliver netns=4026531840 mark=0x300 iface=2(ens4) proto=0x0800 mtu=1460 len=104 35.198.139.208:51820->10.156.15.201:51820(udp)
0xffff973fd1540f00      0    [pwru(19419)]             raw_v4_input netns=4026531840 mark=0x300 iface=2(ens4) proto=0x0800 mtu=1460 len=104 35.198.139.208:51820->10.156.15.201:51820(udp)
0xffff973fd1540f00      0    [pwru(19419)]                  udp_rcv netns=4026531840 mark=0x300 iface=2(ens4) proto=0x0800 mtu=1460 len=104 35.198.139.208:51820->10.156.15.201:51820(udp)
0xffff973fd1540f00      0    [pwru(19419)]           __udp4_lib_rcv netns=4026531840 mark=0x300 iface=2(ens4) proto=0x0800 mtu=1460 len=104 35.198.139.208:51820->10.156.15.201:51820(udp)
0xffff973fd1540f00      0    [pwru(19419)]      udp_unicast_rcv_skb netns=4026531840 mark=0x300 iface=2(ens4) proto=0x0800 mtu=1460 len=104 35.198.139.208:51820->10.156.15.201:51820(udp)
0xffff973fd1540f00      0    [pwru(19419)]        udp_queue_rcv_skb netns=4026531840 mark=0x300 iface=2(ens4) proto=0x0800 mtu=1460 len=104 35.198.139.208:51820->10.156.15.201:51820(udp)
0xffff973fd1540f00      0    [pwru(19419)]    udp_queue_rcv_one_skb netns=4026531840 mark=0x300 iface=2(ens4) proto=0x0800 mtu=1460 len=104 35.198.139.208:51820->10.156.15.201:51820(udp)
0xffff973fd1540f00      0    [pwru(19419)]                 skb_pull netns=4026531840 mark=0x300 iface=2(ens4) proto=0x0800 mtu=1460 len=104 35.198.139.208:51820->10.156.15.201:51820(udp)
0xffff973fd1540f00      0 [kworker/0:2-wg-crypt-wg0(12744)]                 skb_push netns=4026531840 mark=0x300 iface=2(ens4) proto=0x0800 mtu=1460 len=96 35.198.139.208:51820->10.156.15.201:51820(udp)
0xffff973fd1540f00      0 [kworker/0:2-wg-crypt-wg0(12744)]             skb_cow_data netns=4026531840 mark=0x300 iface=2(ens4) proto=0x0800 mtu=1460 len=124 35.198.139.208:51820->10.156.15.201:51820(udp)
0xffff973fd1540f00      0 [kworker/0:2-wg-crypt-wg0(12744)]                 skb_pull netns=4026531840 mark=0x300 iface=2(ens4) proto=0x0800 mtu=1460 len=124 35.198.139.208:51820->10.156.15.201:51820(udp)
0xffff973fd1540f00      0 [kworker/0:2-wg-crypt-wg0(12744)]             skb_to_sgvec netns=4026531840 mark=0x300 iface=2(ens4) proto=0x0800 mtu=1460 len=80 35.198.139.208:51820->10.156.15.201:51820(udp)
0xffff973fd1540f00      0 [kworker/0:2-wg-crypt-wg0(12744)]           __skb_to_sgvec netns=4026531840 mark=0x300 iface=2(ens4) proto=0x0800 mtu=1460 len=80 35.198.139.208:51820->10.156.15.201:51820(udp)
0xffff973fd1540f00      0 [kworker/0:2-wg-crypt-wg0(12744)]                 skb_push netns=4026531840 mark=0x300 iface=2(ens4) proto=0x0800 mtu=1460 len=80 35.198.139.208:51820->10.156.15.201:51820(udp)
0xffff973fd1540f00      0 [kworker/0:2-wg-crypt-wg0(12744)]                 skb_pull netns=4026531840 mark=0x300 iface=2(ens4) proto=0x0800 mtu=1460 len=108 35.198.139.208:51820->10.156.15.201:51820(udp)
0xffff973fd1540f00      0 [ksoftirqd/0(13)]         skb_scrub_packet netns=4026531840 mark=0x300 iface=2(ens4) proto=0x0800 mtu=1460 len=64 35.198.139.208:51820->10.156.15.201:51820(udp)
0xffff973fd1540f00      0 [ksoftirqd/0(13)]         napi_gro_receive netns=4026531840 mark=0x0 iface=3(wg0) proto=0x0800 mtu=1380 len=60 192.168.0.1:59146->192.168.0.2:30080(tcp)
0xffff973fd1540f00      0 [ksoftirqd/0(13)]          dev_gro_receive netns=4026531840 mark=0x0 iface=3(wg0) proto=0x0800 mtu=1380 len=60 192.168.0.1:59146->192.168.0.2:30080(tcp)
0xffff973fd1540f00      0 [ksoftirqd/0(13)]         inet_gro_receive netns=4026531840 mark=0x0 iface=3(wg0) proto=0x0800 mtu=1380 len=60 192.168.0.1:59146->192.168.0.2:30080(tcp)
0xffff973fd1540f00      0 [ksoftirqd/0(13)]         tcp4_gro_receive netns=4026531840 mark=0x0 iface=3(wg0) proto=0x0800 mtu=1380 len=60 192.168.0.1:59146->192.168.0.2:30080(tcp)
0xffff973fd1540f00      0 [ksoftirqd/0(13)]          tcp_gro_receive netns=4026531840 mark=0x0 iface=3(wg0) proto=0x0800 mtu=1380 len=60 192.168.0.1:59146->192.168.0.2:30080(tcp)
0xffff973fd1540f00      0 [ksoftirqd/0(13)]   skb_defer_rx_timestamp netns=4026531840 mark=0x0 iface=3(wg0) proto=0x0800 mtu=1380 len=60 192.168.0.1:59146->192.168.0.2:30080(tcp)
0xffff973fd1540f00      0 [ksoftirqd/0(13)]             tcf_classify netns=4026531840 mark=0x0 iface=3(wg0) proto=0x0800 mtu=1380 len=60 192.168.0.1:59146->192.168.0.2:30080(tcp)
0xffff973fd1540f00      0 [ksoftirqd/0(13)]      skb_ensure_writable netns=4026531840 mark=0x0 iface=3(wg0) proto=0x0800 mtu=1380 len=60 192.168.0.1:59146->192.168.0.2:30080(tcp)
0xffff973fd1540f00      0 [ksoftirqd/0(13)]      skb_ensure_writable netns=4026531840 mark=0x0 iface=3(wg0) proto=0x0800 mtu=1380 len=60 192.168.0.1:59146->192.168.0.2:30080(tcp)
0xffff973fd1540f00      0 [ksoftirqd/0(13)]      skb_ensure_writable netns=4026531840 mark=0x0 iface=3(wg0) proto=0x0800 mtu=1380 len=60 192.168.0.1:59146->10.0.0.17:30080(tcp)
0xffff973fd1540f00      0 [ksoftirqd/0(13)]      skb_ensure_writable netns=4026531840 mark=0x0 iface=3(wg0) proto=0x0800 mtu=1380 len=60 192.168.0.1:59146->10.0.0.17:30080(tcp)
0xffff973fd1540f00      0 [ksoftirqd/0(13)] inet_proto_csum_replace_by_diff netns=4026531840 mark=0x0 iface=3(wg0) proto=0x0800 mtu=1380 len=60 192.168.0.1:59146->10.0.0.17:30080(tcp)
0xffff973fd1540f00      0 [ksoftirqd/0(13)]      skb_ensure_writable netns=4026531840 mark=0x0 iface=3(wg0) proto=0x0800 mtu=1380 len=60 192.168.0.1:59146->10.0.0.17:30080(tcp)
0xffff973fd1540f00      0 [ksoftirqd/0(13)] inet_proto_csum_replace4 netns=4026531840 mark=0x0 iface=3(wg0) proto=0x0800 mtu=1380 len=60 192.168.0.1:59146->10.0.0.17:30080(tcp)
0xffff973fd1540f00      0 [ksoftirqd/0(13)]      skb_ensure_writable netns=4026531840 mark=0x0 iface=3(wg0) proto=0x0800 mtu=1380 len=60 192.168.0.1:59146->10.0.0.17:30080(tcp)
0xffff973fd1540f00      0 [ksoftirqd/0(13)]      skb_ensure_writable netns=4026531840 mark=0x0 iface=3(wg0) proto=0x0800 mtu=1380 len=60 192.168.0.1:59146->10.0.0.17:80(tcp)
0xffff973fd1540f00      0 [ksoftirqd/0(13)]      skb_ensure_writable netns=4026531840 mark=0x0 iface=3(wg0) proto=0x0800 mtu=1380 len=60 192.168.0.1:59146->10.0.0.17:80(tcp)
0xffff973fd1540f00      0 [ksoftirqd/0(13)]      skb_ensure_writable netns=4026531840 mark=0x0 iface=3(wg0) proto=0x0800 mtu=1380 len=60 192.168.0.1:59146->10.0.0.17:80(tcp)
0xffff973fd1540f00      0 [ksoftirqd/0(13)]      skb_ensure_writable netns=4026531840 mark=0x0 iface=3(wg0) proto=0x0800 mtu=1380 len=60 10.0.1.144:59146->10.0.0.17:80(tcp)
0xffff973fd1540f00      0 [ksoftirqd/0(13)]      skb_ensure_writable netns=4026531840 mark=0x0 iface=3(wg0) proto=0x0800 mtu=1380 len=60 10.0.1.144:59146->10.0.0.17:80(tcp)
0xffff973fd1540f00      0 [ksoftirqd/0(13)] inet_proto_csum_replace_by_diff netns=4026531840 mark=0x0 iface=3(wg0) proto=0x0800 mtu=1380 len=60 10.0.1.144:59146->10.0.0.17:80(tcp)
0xffff973fd1540f00      0 [ksoftirqd/0(13)]          skb_do_redirect netns=4026531840 mark=0x300 iface=3(wg0) proto=0x0800 mtu=1380 len=60 10.0.1.144:59146->10.0.0.17:80(tcp)
0xffff973fd1540f00      0 [ksoftirqd/0(13)]           __bpf_redirect netns=4026531840 mark=0x300 iface=3(wg0) proto=0x0800 mtu=1380 len=60 10.0.1.144:59146->10.0.0.17:80(tcp)
0xffff973fd1540f00      0 [ksoftirqd/0(13)] kfree_skb_reason(SKB_DROP_REASON_NOT_SPECIFIED) netns=4026531840 mark=0x300 iface=3(wg0) proto=0x0800 mtu=1380 len=60 10.0.1.144:59146->10.0.0.17:80(tcp)
0xffff973fd1540f00      0 [ksoftirqd/0(13)]   skb_release_head_state netns=4026531840 mark=0x300 iface=3(wg0) proto=0x0800 mtu=1380 len=60 10.0.1.144:59146->10.0.0.17:80(tcp)
0xffff973fd1540f00      0 [ksoftirqd/0(13)]         skb_release_data netns=4026531840 mark=0x300 iface=3(wg0) proto=0x0800 mtu=1380 len=60 10.0.1.144:59146->10.0.0.17:80(tcp)
0xffff973fd1540f00      0 [ksoftirqd/0(13)]            skb_free_head netns=4026531840 mark=0x300 iface=3(wg0) proto=0x0800 mtu=1380 len=60 10.0.1.144:59146->10.0.0.17:80(tcp)
0xffff973fd1540f00      0 [ksoftirqd/0(13)]             kfree_skbmem netns=4026531840 mark=0x300 iface=3(wg0) proto=0x0800 mtu=1380 len=60 10.0.1.144:59146->10.0.0.17:80(tcp)
```
